{
  "id": "DEC-VALIDATE-PING-002",
  "state": "HOLD",
  "scope": "SYSTEM",
  "created_at": "2026-01-03T12:12:00Z",
  "inputs": {
    "human_intent": "Validation heartbeat for Meta Frame v2 PR.",
    "system_data_refs": ["third-space/schema/decision.schema.json"],
    "constraints": ["No execution", "No publication"]
  },
  "invariants": ["Schema validation only"],
  "outputs": {
    "decision": "No-op",
    "bounded_next_actions": []
  },
  "signatures": {
    "human_governor": "MM"
  }
}
