{
  "id": "DEC-ZA-EXTRA-KRAJ-001",
  "state": "COMMIT",
  "scope": "EVENT_RECOGNITION",
  "created_at": "2026-01-02T04:59:00Z",
  "inputs": {
    "human_intent": "Hold recognition of business-party contributors for ZA EXTRA KRAJ live event.",
    "system_data_refs": [
      "ledger/pop-ledger.log",
      "third-space/decision-ledger.log"
    ],
    "constraints": [
      "No identity mapping",
      "No economic settlement yet",
      "Recognition only"
    ]
  },
  "invariants": [
    "Append-only",
    "Fact-first",
    "HOLD → DECIDE → COMMIT"
  ],
  "outputs": {
    "decision": "Recognition is held pending explicit human DECIDE.",
    "bounded_next_actions": [
      "Prepare recognition list",
      "Do not publish"
    ]
  },
  "signatures": {
    "human_governor": "MM"
  }
}
